{
  "generatedAt": "2026-07-14T02:49:58.608Z",
  "generatedFor": "2026-07-14",
  "source": "supabase",
  "ledgerRows": 109,
  "routesTracked": 20,
  "clustersTracked": 8,
  "withPrediction": 8,
  "clusters": [
    {
      "scope": "cluster",
      "route": "→latampass",
      "origem": null,
      "destino": "latampass",
      "confidence": "baixa",
      "windowStart": "2026-07-17",
      "windowEnd": "2026-08-10",
      "samples": 5,
      "medianDays": 21,
      "meanDays": 32,
      "stdevDays": 34,
      "lastWindow": "2026-07-08",
      "cadence": "irregular",
      "typicalPercent": 23,
      "basis": "5 janelas · cadência irregular ~21 dias (média 32, desvio 34) · última 2026-07-08"
    },
    {
      "scope": "cluster",
      "route": "→smiles",
      "origem": null,
      "destino": "smiles",
      "confidence": "baixa",
      "windowStart": "2026-10-31",
      "windowEnd": "2026-11-24",
      "samples": 4,
      "medianDays": 128,
      "meanDays": 241,
      "stdevDays": 259,
      "lastWindow": "2026-07-07",
      "cadence": "esparsa",
      "typicalPercent": 70,
      "basis": "4 janelas · cadência esparsa ~128 dias (média 241, desvio 259) · última 2026-07-07"
    },
    {
      "scope": "cluster",
      "route": "→azul",
      "origem": null,
      "destino": "azul",
      "confidence": "baixa",
      "windowStart": "2027-06-26",
      "windowEnd": "2027-07-20",
      "samples": 3,
      "medianDays": 363,
      "meanDays": 363,
      "stdevDays": 506,
      "lastWindow": "2026-07-10",
      "cadence": "esparsa",
      "typicalPercent": 115,
      "basis": "3 janelas · cadência esparsa ~363 dias (média 363, desvio 506) · última 2026-07-10"
    },
    {
      "scope": "cluster",
      "route": "→connectmiles",
      "origem": null,
      "destino": "connectmiles",
      "confidence": "baixa",
      "windowStart": "2029-02-06",
      "windowEnd": "2029-02-12",
      "samples": 2,
      "medianDays": 943,
      "meanDays": 943,
      "stdevDays": 0,
      "lastWindow": "2026-07-12",
      "cadence": "esparsa",
      "typicalPercent": 40,
      "basis": "2 janelas · cadência esparsa ~943 dias (média 943, desvio 0) · última 2026-07-12"
    },
    {
      "scope": "cluster",
      "route": "→hilton honors",
      "origem": null,
      "destino": "hilton honors",
      "confidence": "em-formacao",
      "windowStart": null,
      "windowEnd": null,
      "samples": 1,
      "medianDays": null,
      "meanDays": null,
      "stdevDays": null,
      "lastWindow": "2024-07-31",
      "cadence": null,
      "typicalPercent": 50,
      "basis": "1 janela(s) — histórico insuficiente para prever"
    },
    {
      "scope": "cluster",
      "route": "→inter",
      "origem": null,
      "destino": "inter",
      "confidence": "em-formacao",
      "windowStart": null,
      "windowEnd": null,
      "samples": 1,
      "medianDays": null,
      "meanDays": null,
      "stdevDays": null,
      "lastWindow": "2026-07-10",
      "cadence": null,
      "typicalPercent": 115,
      "basis": "1 janela(s) — histórico insuficiente para prever"
    },
    {
      "scope": "cluster",
      "route": "→lifemiles",
      "origem": null,
      "destino": "lifemiles",
      "confidence": "em-formacao",
      "windowStart": null,
      "windowEnd": null,
      "samples": 1,
      "medianDays": null,
      "meanDays": null,
      "stdevDays": null,
      "lastWindow": "2026-07-15",
      "cadence": null,
      "typicalPercent": 15,
      "basis": "1 janela(s) — histórico insuficiente para prever"
    },
    {
      "scope": "cluster",
      "route": "→livelo",
      "origem": null,
      "destino": "livelo",
      "confidence": "em-formacao",
      "windowStart": null,
      "windowEnd": null,
      "samples": 1,
      "medianDays": null,
      "meanDays": null,
      "stdevDays": null,
      "lastWindow": "2026-07-05",
      "cadence": null,
      "typicalPercent": 115,
      "basis": "1 janela(s) — histórico insuficiente para prever"
    }
  ],
  "routes": [
    {
      "scope": "route",
      "route": "itau→latampass",
      "origem": "itau",
      "destino": "latampass",
      "confidence": "baixa",
      "windowStart": "2026-07-23",
      "windowEnd": "2026-08-16",
      "samples": 4,
      "medianDays": 34,
      "meanDays": 41,
      "stdevDays": 36,
      "lastWindow": "2026-07-01",
      "cadence": "irregular",
      "typicalPercent": 23,
      "basis": "4 janelas · cadência irregular ~34 dias (média 41, desvio 36) · última 2026-07-01"
    },
    {
      "scope": "route",
      "route": "credicard→latampass",
      "origem": "credicard",
      "destino": "latampass",
      "confidence": "baixa",
      "windowStart": "2026-08-12",
      "windowEnd": "2026-09-05",
      "samples": 3,
      "medianDays": 44,
      "meanDays": 44,
      "stdevDays": 51,
      "lastWindow": "2026-05-28",
      "cadence": "irregular",
      "typicalPercent": 25,
      "basis": "3 janelas · cadência irregular ~44 dias (média 44, desvio 51) · última 2026-05-28"
    },
    {
      "scope": "route",
      "route": "itau→smiles",
      "origem": "itau",
      "destino": "smiles",
      "confidence": "baixa",
      "windowStart": "2026-08-19",
      "windowEnd": "2026-08-25",
      "samples": 2,
      "medianDays": 58,
      "meanDays": 58,
      "stdevDays": 0,
      "lastWindow": "2026-03-01",
      "cadence": "irregular",
      "typicalPercent": 60,
      "basis": "2 janelas · cadência irregular ~58 dias (média 58, desvio 0) · última 2026-03-01"
    },
    {
      "scope": "route",
      "route": "livelo→connectmiles",
      "origem": "livelo",
      "destino": "connectmiles",
      "confidence": "baixa",
      "windowStart": "2029-02-06",
      "windowEnd": "2029-02-12",
      "samples": 2,
      "medianDays": 943,
      "meanDays": 943,
      "stdevDays": 0,
      "lastWindow": "2026-07-12",
      "cadence": "esparsa",
      "typicalPercent": 40,
      "basis": "2 janelas · cadência esparsa ~943 dias (média 943, desvio 0) · última 2026-07-12"
    },
    {
      "scope": "route",
      "route": "amex-mr→lifemiles",
      "origem": "amex-mr",
      "destino": "lifemiles",
      "confidence": "em-formacao",
      "windowStart": null,
      "windowEnd": null,
      "samples": 1,
      "medianDays": null,
      "meanDays": null,
      "stdevDays": null,
      "lastWindow": "2026-07-15",
      "cadence": null,
      "typicalPercent": 15,
      "basis": "1 janela(s) — histórico insuficiente para prever"
    },
    {
      "scope": "route",
      "route": "azul→inter",
      "origem": "azul",
      "destino": "inter",
      "confidence": "em-formacao",
      "windowStart": null,
      "windowEnd": null,
      "samples": 1,
      "medianDays": null,
      "meanDays": null,
      "stdevDays": null,
      "lastWindow": "2026-07-10",
      "cadence": null,
      "typicalPercent": 115,
      "basis": "1 janela(s) — histórico insuficiente para prever"
    },
    {
      "scope": "route",
      "route": "azul→livelo",
      "origem": "azul",
      "destino": "livelo",
      "confidence": "em-formacao",
      "windowStart": null,
      "windowEnd": null,
      "samples": 1,
      "medianDays": null,
      "meanDays": null,
      "stdevDays": null,
      "lastWindow": "2026-07-05",
      "cadence": null,
      "typicalPercent": 115,
      "basis": "1 janela(s) — histórico insuficiente para prever"
    },
    {
      "scope": "route",
      "route": "bancos→smiles",
      "origem": "bancos",
      "destino": "smiles",
      "confidence": "em-formacao",
      "windowStart": null,
      "windowEnd": null,
      "samples": 1,
      "medianDays": null,
      "meanDays": null,
      "stdevDays": null,
      "lastWindow": "2026-07-07",
      "cadence": null,
      "typicalPercent": 70,
      "basis": "1 janela(s) — histórico insuficiente para prever"
    },
    {
      "scope": "route",
      "route": "bb-empresas→latampass",
      "origem": "bb-empresas",
      "destino": "latampass",
      "confidence": "em-formacao",
      "windowStart": null,
      "windowEnd": null,
      "samples": 1,
      "medianDays": null,
      "meanDays": null,
      "stdevDays": null,
      "lastWindow": "2026-07-08",
      "cadence": null,
      "typicalPercent": 20,
      "basis": "1 janela(s) — histórico insuficiente para prever"
    },
    {
      "scope": "route",
      "route": "bb→latampass",
      "origem": "bb",
      "destino": "latampass",
      "confidence": "em-formacao",
      "windowStart": null,
      "windowEnd": null,
      "samples": 1,
      "medianDays": null,
      "meanDays": null,
      "stdevDays": null,
      "lastWindow": "2026-07-08",
      "cadence": null,
      "typicalPercent": 20,
      "basis": "1 janela(s) — histórico insuficiente para prever"
    },
    {
      "scope": "route",
      "route": "credicard→smiles",
      "origem": "credicard",
      "destino": "smiles",
      "confidence": "em-formacao",
      "windowStart": null,
      "windowEnd": null,
      "samples": 1,
      "medianDays": null,
      "meanDays": null,
      "stdevDays": null,
      "lastWindow": "2026-03-01",
      "cadence": null,
      "typicalPercent": 20,
      "basis": "1 janela(s) — histórico insuficiente para prever"
    },
    {
      "scope": "route",
      "route": "esfera→smiles",
      "origem": "esfera",
      "destino": "smiles",
      "confidence": "em-formacao",
      "windowStart": null,
      "windowEnd": null,
      "samples": 1,
      "medianDays": null,
      "meanDays": null,
      "stdevDays": null,
      "lastWindow": "2026-07-08",
      "cadence": null,
      "typicalPercent": 70,
      "basis": "1 janela(s) — histórico insuficiente para prever"
    },
    {
      "scope": "route",
      "route": "inter-loop→azul",
      "origem": "inter-loop",
      "destino": "azul",
      "confidence": "em-formacao",
      "windowStart": null,
      "windowEnd": null,
      "samples": 1,
      "medianDays": null,
      "meanDays": null,
      "stdevDays": null,